{"$schema":"https://json-schema.org/draft/2020-12/schema","$id":"https://github.com/f2re/synopsis_game/training/lora/props/manifest.schema.json","title":"26063 props LoRA generation manifest","type":"object","additionalProperties":false,"required":["schema_version","dataset","adapter","trigger","target_render","generation_contract","enums","style_contract","prompt_prefix","negative_prompt","subjects","samples"],"properties":{"schema_version":{"const":1},"dataset":{"const":"synopsis_pixel_prop"},"adapter":{"const":"props"},"trigger":{"const":"synopsis_pixel_prop"},"target_render":{"type":"object","additionalProperties":false,"required":["min_long_edge","scaling"],"properties":{"min_long_edge":{"type":"integer","minimum":1024},"scaling":{"const":"native_or_integer_nearest"}}},"generation_contract":{"type":"object","additionalProperties":false,"required":["images_per_job","collage","allow_flip","allow_recolour_clone","allow_smooth_upscale","no_text","one_object_per_image","background"],"properties":{"images_per_job":{"const":1},"collage":{"const":false},"allow_flip":{"const":false},"allow_recolour_clone":{"const":false},"allow_smooth_upscale":{"const":false},"no_text":{"const":true},"one_object_per_image":{"const":true},"background":{"const":"neutral_light_gray"}}},"enums":{"type":"object"},"style_contract":{"type":"object"},"prompt_prefix":{"type":"string","minLength":100},"negative_prompt":{"type":"string","minLength":30},"subjects":{"type":"object","minProperties":36,"maxProperties":36,"additionalProperties":{"type":"string","minLength":20}},"samples":{"type":"array","minItems":36,"maxItems":36,"items":{"type":"object","additionalProperties":false,"required":["id","subject_id","asset_type","lineage_id","split","view","background","independent_render","num_images","min_long_edge","output_path"],"properties":{"id":{"type":"string","pattern":"^prop-[a-z0-9-]+-[0-9]{2}$"},"subject_id":{"type":"string","minLength":1},"asset_type":{"enum":["physical_prop","icon","frame"]},"lineage_id":{"type":"string","pattern":"^prop-src-[0-9]{3}$"},"split":{"enum":["train","validation"]},"view":{"enum":["front","three_quarter","side","top"]},"background":{"const":"neutral_light_gray"},"independent_render":{"const":true},"num_images":{"const":1},"min_long_edge":{"type":"integer","minimum":1024},"output_path":{"type":"string","pattern":"^datasets/lora/props/source/.+\\.png$"}}}}}}
